{
  "schema": "yaaw.handoff/v4",
  "framework": {},
  "role": "implementer",
  "workflow": "implementation.implement-ticket",
  "operation": "implement-ticket",
  "instruction": {"document":".yaaw-core/system/roles/implementer.md","operation":"implement-ticket"},
  "desired_intent": "IMPLEMENT",
  "active_artifact": "ticket",
  "ticket": "TASK-000",
  "references": [],
  "reads": [],
  "writes": [],
  "forbidden_writes": [],
  "revisions": {"product":1,"engineering":1,"spec":1,"ticket":1},
  "basis": {"product_digest":null,"engineering_digest":null,"spec_digest":null,"ticket_digest":null,"ticket_status":"READY"},
  "expertise": [],
  "host_expertise": [],
  "expected_output": "bounded implementation and evidence",
  "result_vocabulary": ["VERIFICATION_PASS","BLOCKED"],
  "repository_requirement": "IDENTITY",
  "repository": {"schema":"yaaw.repository-identity/v2","algorithm":"yaaw-worktree-v3","status":"READY","workspace_scope":".","git_root_relation":"same","head_commit":"COMMIT","dirty":false,"worktree_digest":"sha256:DIGEST","components":{"status_sha256":"HASH","unstaged_diff_sha256":"HASH","staged_diff_sha256":"HASH","untracked_manifest_sha256":"HASH"},"changed_paths":[],"error":null}
}
